{
  "generatedAt": "2026-04-16T20:28:19.304Z",
  "repoRoot": "/sessions/trusting-nifty-archimedes/mnt/The Nexus",
  "canonicalStateFile": "docs/wave2-canonical-state.json",
  "executionPlanFile": "docs/v2-wave2-execution-plan.md",
  "backlogFile": "docs/backlog-unified-status-and-order.md",
  "wave2": {
    "totalTasks": 281,
    "currentScanPoint": 38,
    "activeTask": {
      "execution_order": 38,
      "taskName": "Create cross-project pattern disclosure panel",
      "recordedState": "blocked"
    },
    "previousTask": {
      "execution_order": 37,
      "taskName": "Create AI learning workspace template",
      "recordedState": "trueGreen"
    },
    "stateCounts": {
      "trueGreen": 145,
      "blocked": 39,
      "bridge-deferred": 12,
      "in-progress": 85
    }
  },
  "coreFiles": [
    {
      "path": "src/core/context-builder.js",
      "exists": true,
      "size": 169462,
      "mtimeMs": 1776353820032.7078,
      "sha256": "b2ab57f5a722a88aab91766e6e0d85ff4bc6bc98ab7850d67a77d6c1db3c2ada"
    },
    {
      "path": "src/core/project-service.js",
      "exists": true,
      "size": 144212,
      "mtimeMs": 1776353820033.2852,
      "sha256": "8129a75dfddd453daf4b07e641c351a825d119eb038554be4db86793aa94c038"
    },
    {
      "path": "src/server.js",
      "exists": true,
      "size": 58742,
      "mtimeMs": 1776256682438.7053,
      "sha256": "118d3584b8d0f69be6473e2d94e6501386dd5ded9d0f0ed9a817375dc5ccce69"
    }
  ],
  "recentRepoState": {
    "gitAvailable": true,
    "workingTreeDirty": true,
    "changedFiles": [
      "docs/backlog-unified-status-and-order.md",
      "docs/v2-wave2-execution-plan.md",
      "docs/v2-wave3-execution-plan.md",
      "docs/v2-wave4-execution-plan.md",
      "nexus-db/db-javascript/default/strings/0/buckets/page-000000",
      "nexus-db/db-javascript/default/strings/0/metadata/page-000000",
      "nexus-db/db-javascript/default/strings/0/pageDump/page-000000000",
      "src/core/agent-runtime.js",
      "src/core/ai-companion-workspace-template.js",
      "src/core/collaboration-activity-feed.js",
      "src/core/color-usage-rules.js",
      "src/core/companion-interruption-guard.js",
      "src/core/component-contract-schema.js",
      "src/core/consistency-validator.js",
      "src/core/context-builder.js",
      "src/core/cross-tenant-leak-detector.js",
      "src/core/dashboard-template.js",
      "src/core/data-display-components.js",
      "src/core/design-token-schema.js",
      "src/core/detail-page-template.js",
      "src/core/feedback-components.js",
      "src/core/growth-marketing-planner.js",
      "src/core/interaction-states-system.js",
      "src/core/journey-map.js",
      "src/core/layout-components.js",
      "src/core/learning-insight-ui-schema.js",
      "src/core/live-update-transport-layer.js",
      "src/core/loading-empty-error-states-definition.js",
      "src/core/management-template.js",
      "src/core/memory.js",
      "src/core/mobile-readiness-checklist.js",
      "src/core/mobile-usability-validator.js",
      "src/core/navigation-components.js",
      "src/core/orchestrator.js",
      "src/core/partial-acceptance-flow.js",
      "src/core/planner.js",
      "src/core/primary-action-validator.js",
      "src/core/primary-user-journeys.js",
      "src/core/primitive-components.js",
      "src/core/project-service.js",
      "src/core/recommendation-reasoning-panel-contract.js",
      "src/core/screen-contract-schema.js",
      "src/core/screen-flow-map.js",
      "src/core/screen-goal-cta.js",
      "src/core/screen-inventory.js",
      "src/core/screen-review-assembler.js",
      "src/core/screen-template-schema.js",
      "src/core/screen-validation-checklist.js",
      "src/core/spacing-layout-system.js",
      "src/core/state-coverage-validator.js",
      "src/core/state-driven-template-variants.js",
      "src/core/subscription-lifecycle-module.js",
      "src/core/task-result-ingestion.js",
      "src/core/types.js",
      "src/core/typography-system.js",
      "src/core/workflow-template.js",
      "src/core/workspace-settings-module.js",
      "src/server.js",
      "test/ai-companion-workspace-template.test.js",
      "test/collaboration-activity-feed.test.js",
      "test/collaboration-event-schema.test.js",
      "test/color-usage-rules.test.js",
      "test/companion-animation-state-rules.test.js",
      "test/companion-dock-panel-contract.test.js",
      "test/companion-interruption-guard.test.js",
      "test/companion-message-priority-resolver.test.js",
      "test/companion-mode-controls.test.js",
      "test/companion-state-model.test.js",
      "test/companion-trigger-policy.test.js",
      "test/component-contract-schema.test.js",
      "test/consistency-validator.test.js",
      "test/context-builder.test.js",
      "test/cross-tenant-leak-detector.test.js",
      "test/dashboard-template.test.js",
      "test/data-display-components.test.js",
      "test/design-token-schema.test.js",
      "test/detail-page-template.test.js",
      "test/feedback-components.test.js",
      "test/interaction-states-system.test.js",
      "test/journey-map.test.js",
      "test/layout-components.test.js",
      "test/learning-insight-ui-schema.test.js",
      "test/live-update-transport-layer.test.js",
      "test/loading-empty-error-states-definition.test.js",
      "test/management-template.test.js",
      "test/mobile-readiness-checklist.test.js",
      "test/mobile-usability-validator.test.js",
      "test/navigation-components.test.js",
      "test/orchestrator.test.js",
      "test/partial-acceptance-flow.test.js",
      "test/planner.test.js",
      "test/primary-action-validator.test.js",
      "test/primary-user-journeys.test.js",
      "test/primitive-components.test.js",
      "test/project-graph.test.js",
      "test/project-service.test.js",
      "test/project-state.test.js",
      "test/recommendation-reasoning-panel-contract.test.js",
      "test/screen-contract-schema.test.js",
      "test/screen-flow-map.test.js",
      "test/screen-goal-cta.test.js",
      "test/screen-inventory.test.js",
      "test/screen-review-assembler.test.js",
      "test/screen-template-schema.test.js",
      "test/screen-validation-checklist.test.js",
      "test/server-health-endpoints.test.js",
      "test/spacing-layout-system.test.js",
      "test/state-coverage-validator.test.js",
      "test/state-driven-template-variants.test.js",
      "test/subscription-lifecycle-module.test.js",
      "test/typography-system.test.js",
      "test/web-app-wave1-cockpit.test.js",
      "test/workflow-template.test.js",
      "test/workspace-settings-module.test.js",
      "web/app.js",
      "web/index.html",
      "web/styles.css"
    ],
    "untrackedFiles": [
      "docs/first-user-flow-ui-contract.md",
      "docs/nexus-code-first-audit.md",
      "docs/nexus-wave2-baseline.md",
      "docs/runtime/README.md",
      "docs/runtime/codex-runner-guide.md",
      "docs/runtime/core-invariants.json",
      "docs/runtime/core-state-pack.schema.json",
      "docs/runtime/generated/core-invariants-report.json",
      "docs/runtime/generated/core-state-pack.json",
      "docs/runtime/generated/doc-sync-report.json",
      "docs/runtime/generated/impact-report.json",
      "docs/runtime/generated/postflight-report.json",
      "docs/runtime/generated/preflight-summary.json",
      "docs/v1-product-flow-foundation.md",
      "docs/wave2-canonical-state.json",
      "scripts/analyze-impact.mjs",
      "scripts/check-core-invariants.mjs",
      "scripts/check-wave2-doc-sync.mjs",
      "scripts/generate-core-state-pack.mjs",
      "scripts/lib/canonical.mjs",
      "scripts/lib/fs-utils.mjs",
      "scripts/lib/paths.mjs",
      "scripts/postflight-verify.mjs",
      "scripts/run-wave2-preflight.mjs",
      "src/core/action-success-scoring-engine.js",
      "src/core/analytics-api.js",
      "src/core/analytics-dashboard-schema.js",
      "src/core/analytics-dashboard-screen.js",
      "src/core/analytics-summary-assembler.js",
      "src/core/baseline-approval-outcome-schema.js",
      "src/core/baseline-collaboration-activity-history-assembler.js",
      "src/core/baseline-collaboration-event-assembler.js",
      "src/core/baseline-effort-estimator.js",
      "src/core/baseline-learning-insights-assembler.js",
      "src/core/baseline-tenant-boundary-evidence-assembler.js",
      "src/core/baseline-user-preference-profile-assembler.js",
      "src/core/billing-enforcement-guard.js",
      "src/core/billing-event-ingestion-service.js",
      "src/core/billing-event-normalizer.js",
      "src/core/billing-settings-model.js",
      "src/core/contract-to-component-mapper.js",
      "src/core/feature-success-schema.js",
      "src/core/feature-success-tracker.js",
      "src/core/generated-screen-preview-renderer.js",
      "src/core/nexus-positioning-schema.js",
      "src/core/outcome-evaluation-schema.js",
      "src/core/paying-user-tracker.js",
      "src/core/product-iteration-feedback-engine.js",
      "src/core/productivity-summary-aggregator.js",
      "src/core/project-creation-aggregation-module.js",
      "src/core/project-creation-event-schema.js",
      "src/core/project-creation-tracker.js",
      "src/core/project-state-screen-renderer.js",
      "src/core/provider-billing-event-adapter.js",
      "src/core/reasonable-usage-policy-resolver.js",
      "src/core/renderable-screen-model-schema.js",
      "src/core/retention-and-reengagement-planner.js",
      "src/core/retention-metrics-aggregator.js",
      "src/core/returning-user-resolver.js",
      "src/core/revenue-summary-aggregator.js",
      "src/core/runtime-screen-registry-resolver.js",
      "src/core/screen-composition-runtime.js",
      "src/core/screen-state-variant-resolver.js",
      "src/core/session-activity-tracker.js",
      "src/core/task-execution-metric-schema.js",
      "src/core/task-execution-tracker.js",
      "src/core/task-throughput-aggregator.js",